id_producto;nombre;precio;categoria_actual;subcategoria_actual;categoria_nueva;subcategoria_nueva
ME-1625;Tiramisú Hacendado;135;Bazar y Varios;Otros bazar;;
ME-3975;Tiras adhesivas protectoras Classic color beige Deliplus surtidas, elásticas y transpirables;95;Bazar y Varios;Otros bazar;;
ME-3985;Tiras adhesivas protectoras de espuma acolchado Deliplus protección extra;13;Bazar y Varios;Otros bazar;;
ME-3983;Tiras adhesivas protectoras infantiles Deliplus surtidas, elásticas y transpirables;13;Bazar y Varios;Otros bazar;;
ME-1089;Tiras de maíz frito sabor barbacoa Hacendado;8;Bazar y Varios;Otros bazar;;
ME-0639;Tiras faciales limpia poros Deliplus;30;Bazar y Varios;Otros bazar;;
ME-1634;Tocino de cielo Hacendado;19;Bazar y Varios;Otros bazar;;
ME-2135;Tofu firme Hacendado;19;Bazar y Varios;Otros bazar;;
ME-2119;Tomillo Hacendado;105;Bazar y Varios;Otros bazar;;
ME-3719;Tónica Hacendado;222;Bazar y Varios;Otros bazar;;
ME-3721;Tónica zero calorías Schweppes;784;Bazar y Varios;Otros bazar;;
ME-0644;Tónico facial árbol de té y prebióticos Facial Clean;32;Bazar y Varios;Otros bazar;;
ME-0645;Tónico facial vitamina C y niacinamida Facial Clean iluminador y antioxidante;32;Bazar y Varios;Otros bazar;;
ME-1101;Torreznos Hacendado;14;Bazar y Varios;Otros bazar;;
ME-1098;Torreznos sabor barbacoa Hacendado;14;Bazar y Varios;Otros bazar;;
ME-2754;Tortellini carne Pagani;14;Bazar y Varios;Otros bazar;;
ME-0724;Tortillas de avena 51% Hacendado;185;Bazar y Varios;Otros bazar;;
ME-0725;Tortillas de maíz Hacendado;185;Bazar y Varios;Otros bazar;;
ME-0714;Tortillas de trigo Hacendado;115;Bazar y Varios;Otros bazar;;
ME-0717;Tortillas de trigo integrales Hacendado;155;Bazar y Varios;Otros bazar;;
ME-2621;Tortitas de maíz campestre Hacendado;175;Bazar y Varios;Otros bazar;;
ME-2620;Tortitas de maíz con sabor a jamón Hacendado;175;Bazar y Varios;Otros bazar;;
ME-2614;Tortitas de maíz Hacendado;11;Bazar y Varios;Otros bazar;;
ME-4395;Trampa matacucarachas Bosque Verde;295;Bazar y Varios;Otros bazar;;
ME-2579;Tratamiento Anti Frizz Deliplus todo tipo de cabello;40;Bazar y Varios;Otros bazar;;
ME-1130;Tratamiento crema reductor intensivo noche Deliplus;49;Bazar y Varios;Otros bazar;;
ME-1793;Tratamiento para uñas base 9 en 1 Deliplus vitaminada y alisadora;35;Bazar y Varios;Otros bazar;;
ME-1794;Tratamiento para uñas endurecedor Deliplus;35;Bazar y Varios;Otros bazar;;
ME-1795;Tratamiento para uñas gel brillo top coat Deliplus secado rápido;35;Bazar y Varios;Otros bazar;;
ME-1799;Tratamiento para uñas y cutículas Sérum SOS Deliplus;35;Bazar y Varios;Otros bazar;;
ME-0995;Trenza con nueces 4%;10;Bazar y Varios;Otros bazar;;
ME-1099;Trigo snack sabor ahumado Hacendado;85;Bazar y Varios;Otros bazar;;
ME-1009;Trozo de vacuno para cocido;453;Bazar y Varios;Otros bazar;;
ME-0254;Trucha Arco iris abierta a la espalda;49;Bazar y Varios;Otros bazar;;
ME-2138;Tsatsiki Hacendado;19;Bazar y Varios;Otros bazar;;
ME-2719;Tubitos Hacendado;205;Bazar y Varios;Otros bazar;;
ME-4449;Vasos grandes de plástico Bosque Verde reutilizables;165;Bazar y Varios;Otros bazar;;
ME-4464;Vasos medianos de plástico Bosque Verde reutilizables;16;Bazar y Varios;Otros bazar;;
ME-1686;Vela de cumpleaños 0 Hacendado;85;Bazar y Varios;Otros bazar;;
ME-1687;Vela de cumpleaños 1 Hacendado;85;Bazar y Varios;Otros bazar;;
ME-1688;Vela de cumpleaños 2 Hacendado;85;Bazar y Varios;Otros bazar;;
ME-1689;Vela de cumpleaños 3 Hacendado;85;Bazar y Varios;Otros bazar;;
ME-1690;Vela de cumpleaños 4 Hacendado;85;Bazar y Varios;Otros bazar;;
ME-1691;Vela de cumpleaños 5 Hacendado;85;Bazar y Varios;Otros bazar;;
ME-1692;Vela de cumpleaños 6 Hacendado;85;Bazar y Varios;Otros bazar;;
ME-1693;Vela de cumpleaños 7 Hacendado;85;Bazar y Varios;Otros bazar;;
ME-1694;Vela de cumpleaños 8 Hacendado;85;Bazar y Varios;Otros bazar;;
ME-1695;Vela de cumpleaños 9 Hacendado;85;Bazar y Varios;Otros bazar;;
ME-4478;Vela perfumada Berries Bosque Verde;185;Bazar y Varios;Otros bazar;;
ME-4471;Vela perfumada Chai Bosque Verde;185;Bazar y Varios;Otros bazar;;
ME-4481;Vela perfumada Crème Brûlée Bosque Verde;55;Bazar y Varios;Otros bazar;;
ME-4472;Vela perfumada Fruta Tropical Bosque Verde;185;Bazar y Varios;Otros bazar;;
ME-4480;Vela perfumada Matcha Bosque Verde;185;Bazar y Varios;Otros bazar;;
ME-4477;Vela perfumada Santal Vanilla Bosque Verde;185;Bazar y Varios;Otros bazar;;
ME-1696;Velas de cumpleaños Hacendado;105;Bazar y Varios;Otros bazar;;
ME-3989;Venda elástica cohesiva Deliplus fijación fuerte;21;Bazar y Varios;Otros bazar;;
ME-0160;Verdura para crema de calabaza;40;Bazar y Varios;Otros bazar;;
ME-3332;Verduras asadas Hacendado;29;Bazar y Varios;Otros bazar;;
ME-0575;Vermouth rojo Martini;119;Bazar y Varios;Otros bazar;;
ME-3340;Yemas de espárragos Hacendado;325;Bazar y Varios;Otros bazar;;
