﻿id_producto;nombre;precio;categoria_actual;subcategoria_actual;categoria_nueva;subcategoria_nueva
ME-3959;Cápsulas Cola de caballo Deliplus;385;Bazar y Varios;Otros bazar;Revisar;Revisar
ME-3963;Cápsulas Colagen Antiox piel Deliplus;495;Bazar y Varios;Otros bazar;Revisar;Revisar
ME-3969;Cápsulas Gases Deliplus;45;Bazar y Varios;Otros bazar;Revisar;Revisar
ME-3955;Cápsulas LaxForte Deliplus;395;Bazar y Varios;Otros bazar;Revisar;Revisar
ME-3961;Cápsulas Memory Forte Deliplus;395;Bazar y Varios;Otros bazar;Revisar;Revisar
ME-3966;Cápsulas Menopausia Deliplus;45;Bazar y Varios;Otros bazar;Revisar;Revisar
ME-0681;Cápsulas para ojos Regen Skin Deliplus;50;Bazar y Varios;Otros bazar;Revisar;Revisar
ME-3970;Cápsulas Probiótico Deliplus;595;Bazar y Varios;Otros bazar;Revisar;Revisar
ME-3962;Cápsulas Quemagrasas Deliplus;395;Bazar y Varios;Otros bazar;Revisar;Revisar
ME-3965;Cápsulas Spirulina + vitamina B12 Deliplus;50;Bazar y Varios;Otros bazar;Revisar;Revisar
ME-3956;Cápsulas Valeriana Deliplus;415;Bazar y Varios;Otros bazar;Revisar;Revisar
ME-0996;Caracola con pasas 10%;10;Bazar y Varios;Otros bazar;Revisar;Revisar
ME-4486;Carbón vegetal Bosque Verde;405;Bazar y Varios;Otros bazar;Revisar;Revisar
ME-3345;Cardo troceado Hacendado;195;Bazar y Varios;Otros bazar;Revisar;Revisar
ME-0513;Carpaccio de vacuno;41;Bazar y Varios;Otros bazar;Revisar;Revisar
ME-1390;Castañas cocidas y peladas Hacendado;14;Bazar y Varios;Otros bazar;Revisar;Revisar
ME-2176;Cayena guindillas Hacendado;136;Bazar y Varios;Otros bazar;Revisar;Revisar
ME-2177;Cayena molida Hacendado;165;Bazar y Varios;Otros bazar;Revisar;Revisar
ME-1525;Cebollitas Hacendado;165;Bazar y Varios;Otros bazar;Revisar;Revisar
ME-1577;Cecina ahumada natural Embutidos Pajariel lonchas;42;Bazar y Varios;Otros bazar;Revisar;Revisar
ME-1816;Cepillo de uñas Deliplus;19;Bazar y Varios;Otros bazar;Revisar;Revisar
ME-4082;Cepillo limpiabiberón y tetina Deliplus;25;Bazar y Varios;Otros bazar;Revisar;Revisar
ME-4514;Cepillo para lavar con asa Bosque Verde;19;Bazar y Varios;Otros bazar;Revisar;Revisar
ME-0876;Cepillos interdentales Extrafinos cónicos Deliplus;15;Bazar y Varios;Otros bazar;Revisar;Revisar
ME-0881;Cepillos interdentales Finos cónicos Deliplus;15;Bazar y Varios;Otros bazar;Revisar;Revisar
ME-0890;Cepillos interdentales Micro Deliplus;15;Bazar y Varios;Otros bazar;Revisar;Revisar
ME-1478;Cera caliente en tarro Deliplus piel sensible;41;Bazar y Varios;Otros bazar;Revisar;Revisar
ME-1479;Cera facial caliente en tarro Deliplus piel sensible;375;Bazar y Varios;Otros bazar;Revisar;Revisar
ME-4286;Cera Multisuperficies Bosque Verde;45;Bazar y Varios;Otros bazar;Revisar;Revisar
ME-3319;Champiñón entero Hacendado;145;Bazar y Varios;Otros bazar;Revisar;Revisar
ME-3318;Champiñón laminado Hacendado;18;Bazar y Varios;Otros bazar;Revisar;Revisar
ME-2346;Chili con carne Hacendado;28;Bazar y Varios;Otros bazar;Revisar;Revisar
ME-0207;Chirla viva;46;Bazar y Varios;Otros bazar;Revisar;Revisar
ME-0611;Chistorra;15;Bazar y Varios;Otros bazar;Revisar;Revisar
ME-1536;Chopped cocido en lata Hacendado finas lonchas;185;Bazar y Varios;Otros bazar;Revisar;Revisar
ME-3344;Chucrut al estilo bávaro Hengstenberg;22;Bazar y Varios;Otros bazar;Revisar;Revisar
ME-0523;Churrasquito de vacuno añojo;355;Bazar y Varios;Otros bazar;Revisar;Revisar
ME-0887;Cinta dental con cera y sabor menta;25;Bazar y Varios;Otros bazar;Revisar;Revisar
ME-1424;Ciruelas desecadas sin hueso Hacendado;214;Bazar y Varios;Otros bazar;Revisar;Revisar
ME-2182;Clavo en grano Hacendado;175;Bazar y Varios;Otros bazar;Revisar;Revisar
ME-4317;Cloro 5 acciones disolución lenta tabletas para piscina;310;Bazar y Varios;Otros bazar;Revisar;Revisar
ME-4313;Cloro rápido granulado para piscina;325;Bazar y Varios;Otros bazar;Revisar;Revisar
ME-1876;Cocido Hacendado;19;Bazar y Varios;Otros bazar;Revisar;Revisar
ME-1414;Cocktail crunchy sabores Hacendado;175;Bazar y Varios;Otros bazar;Revisar;Revisar
ME-1419;Cocktail fruta deshidratada Hacendado;19;Bazar y Varios;Otros bazar;Revisar;Revisar
ME-1412;Cocktail mezcla Hacendado;175;Bazar y Varios;Otros bazar;Revisar;Revisar
ME-1416;Cocktail natural Hacendado;27;Bazar y Varios;Otros bazar;Revisar;Revisar
ME-1415;Cocktail rodeo Hacendado;185;Bazar y Varios;Otros bazar;Revisar;Revisar
ME-1420;Cocktail rumba Hacendado;175;Bazar y Varios;Otros bazar;Revisar;Revisar
ME-1698;Coco rallado Hacendado;13;Bazar y Varios;Otros bazar;Revisar;Revisar
ME-0444;Codornices;42;Bazar y Varios;Otros bazar;Revisar;Revisar
ME-3948;Colágeno soluble sabor limón Colagen;53;Bazar y Varios;Otros bazar;Revisar;Revisar
ME-4394;Colgador antipolillas Lavanda Bosque Verde;155;Bazar y Varios;Otros bazar;Revisar;Revisar
ME-4392;Colgador antipolillas Ropa Limpia Bosque Verde;155;Bazar y Varios;Otros bazar;Revisar;Revisar
ME-4249;Colgador WC Azul limpieza activa Bosque Verde;125;Bazar y Varios;Otros bazar;Revisar;Revisar
ME-4246;Colgador WC Azul perfume marino Bosque Verde;125;Bazar y Varios;Otros bazar;Revisar;Revisar
ME-4258;Colgador WC Dália Bosque Verde;13;Bazar y Varios;Otros bazar;Revisar;Revisar
ME-4259;Colgador WC Maxigotas Spa Bosque Verde;13;Bazar y Varios;Otros bazar;Revisar;Revisar
ME-4257;Colgador WC Power Activ Pino Bref;295;Bazar y Varios;Otros bazar;Revisar;Revisar
ME-1096;Combinado de aperitivos Hacendado;16;Bazar y Varios;Otros bazar;Revisar;Revisar
ME-1413;Combinado frutos secos, frutas desecadas y semillas de calabaza Hacendado;26;Bazar y Varios;Otros bazar;Revisar;Revisar
ME-2172;Comino en grano Hacendado;195;Bazar y Varios;Otros bazar;Revisar;Revisar
ME-2171;Comino molido Hacendado;12;Bazar y Varios;Otros bazar;Revisar;Revisar
ME-1266;Compresa con alas noche Ausonia;25;Bazar y Varios;Otros bazar;Revisar;Revisar
ME-1258;Compresa con alas noche Deliplus;115;Bazar y Varios;Otros bazar;Revisar;Revisar
ME-1255;Compresa con alas noche plegada Deliplus Classic;14;Bazar y Varios;Otros bazar;Revisar;Revisar
ME-1268;Compresa con alas normal Ausonia;25;Bazar y Varios;Otros bazar;Revisar;Revisar
ME-1257;Compresa con alas normal Deliplus;215;Bazar y Varios;Otros bazar;Revisar;Revisar
ME-1273;Compresa con alas normal Deliplus Cotton;34;Bazar y Varios;Otros bazar;Revisar;Revisar
ME-1263;Compresa con alas normal Evax cotton like;45;Bazar y Varios;Otros bazar;Revisar;Revisar
ME-1269;Compresa con alas super Ausonia;25;Bazar y Varios;Otros bazar;Revisar;Revisar
ME-1261;Compresa con alas super Deliplus;215;Bazar y Varios;Otros bazar;Revisar;Revisar
ME-1274;Compresa con alas super Deliplus Cotton;34;Bazar y Varios;Otros bazar;Revisar;Revisar
ME-1265;Compresa con alas super Evax cotton like fresh;435;Bazar y Varios;Otros bazar;Revisar;Revisar
ME-1323;Compresa de incontinencia Tena masculina;50;Bazar y Varios;Otros bazar;Revisar;Revisar
ME-1259;Compresa sin alas de incontinencia Deliplus Extra;335;Bazar y Varios;Otros bazar;Revisar;Revisar
ME-1256;Compresa sin alas de incontinencia Deliplus Maxi;315;Bazar y Varios;Otros bazar;Revisar;Revisar
ME-1275;Compresa sin alas de incontinencia Deliplus Maxi Night;315;Bazar y Varios;Otros bazar;Revisar;Revisar
ME-1271;Compresa sin alas de incontinencia Deliplus Mini;335;Bazar y Varios;Otros bazar;Revisar;Revisar
ME-1264;Compresa sin alas de incontinencia Deliplus Normal;335;Bazar y Varios;Otros bazar;Revisar;Revisar
ME-1267;Compresa sin alas normal Deliplus;215;Bazar y Varios;Otros bazar;Revisar;Revisar
ME-1254;Compresa sin alas normal Deliplus Classic;11;Bazar y Varios;Otros bazar;Revisar;Revisar
ME-1276;Compresa sin alas normal Evax cotton like;285;Bazar y Varios;Otros bazar;Revisar;Revisar
ME-1260;Compresa sin alas normal plegada Deliplus Classic;12;Bazar y Varios;Otros bazar;Revisar;Revisar
ME-1270;Compresa sin alas super Deliplus;215;Bazar y Varios;Otros bazar;Revisar;Revisar
ME-1262;Compresa sin alas super plegada Deliplus Classic;14;Bazar y Varios;Otros bazar;Revisar;Revisar
ME-3968;Comprimidos cabello y uñas Deliplus;395;Bazar y Varios;Otros bazar;Revisar;Revisar
ME-3951;Comprimidos Dormir Deliplus;395;Bazar y Varios;Otros bazar;Revisar;Revisar
ME-3952;Comprimidos efervescentes vitamina C y zinc Deliplus sabor limón;195;Bazar y Varios;Otros bazar;Revisar;Revisar
ME-3950;Comprimidos Vitaminas y Minerales Deliplus;30;Bazar y Varios;Otros bazar;Revisar;Revisar
ME-3100;Concha fina al natural Hacendado;19;Bazar y Varios;Otros bazar;Revisar;Revisar
ME-0540;Conejo entero;1032;Bazar y Varios;Otros bazar;Revisar;Revisar
ME-3489;Confitura de melocotón Hacendado 0% azúcares añadidos;16;Bazar y Varios;Otros bazar;Revisar;Revisar
ME-0677;Contorno de ojos Antiarrugas e Iluminador con silicio Sisbela Reafirm Deliplus;45;Bazar y Varios;Otros bazar;Revisar;Revisar
ME-0680;Contorno de ojos arrugas y bolsas Deliplus Prevent Age Skin;45;Bazar y Varios;Otros bazar;Revisar;Revisar
ME-1616;Contorno de ojos Men Care Regen Skin Deliplus;50;Bazar y Varios;Otros bazar;Revisar;Revisar
ME-0679;Contorno de ojos y párpados Dragon's blood Anti Ox;45;Bazar y Varios;Otros bazar;Revisar;Revisar
ME-2462;Copos de avena Brüggen;135;Bazar y Varios;Otros bazar;Revisar;Revisar
ME-2461;Copos de avena sin gluten Hacendado;21;Bazar y Varios;Otros bazar;Revisar;Revisar
ME-1190;Coquito;19;Bazar y Varios;Otros bazar;Revisar;Revisar
ME-3028;Corrector fluido Hydra Deliplus 100 porcelana;50;Bazar y Varios;Otros bazar;Revisar;Revisar
ME-3029;Corrector fluido Hydra Deliplus 200 vainilla;50;Bazar y Varios;Otros bazar;Revisar;Revisar
ME-3030;Corrector fluido Hydra Deliplus 300 arena;50;Bazar y Varios;Otros bazar;Revisar;Revisar
ME-3023;Corrector fluido multiusos Long Lasting Deliplus mate 100 beige rosado;475;Bazar y Varios;Otros bazar;Revisar;Revisar
ME-3021;Corrector Mate Stick Deliplus 100 beige rosado;425;Bazar y Varios;Otros bazar;Revisar;Revisar
ME-3019;Corrector serum luminoso Deliplus 100 beige claro;50;Bazar y Varios;Otros bazar;Revisar;Revisar
ME-3020;Corrector serum luminoso Deliplus 200 beige oscuro;50;Bazar y Varios;Otros bazar;Revisar;Revisar
ME-1815;Corta cutículas Deliplus;21;Bazar y Varios;Otros bazar;Revisar;Revisar
ME-1819;Cortaúñas manos y pies Deliplus;19;Bazar y Varios;Otros bazar;Revisar;Revisar
ME-2595;Cous cous mediano Hacendado;195;Bazar y Varios;Otros bazar;Revisar;Revisar
ME-0879;Crema adhesiva para prótesis dentales Benfix sin sabor;35;Bazar y Varios;Otros bazar;Revisar;Revisar
ME-3660;Crema al cacao con avellanas Hacendado;205;Bazar y Varios;Otros bazar;Revisar;Revisar
ME-3665;Crema al cacao con avellanas Hacendado de 2 sabores;205;Bazar y Varios;Otros bazar;Revisar;Revisar
ME-3662;Crema al cacao con avellanas Nutella;40;Bazar y Varios;Otros bazar;Revisar;Revisar
ME-1613;Crema cara, cuerpo y manos Nivea Men;495;Bazar y Varios;Otros bazar;Revisar;Revisar
ME-1633;Crema catalana Hacendado;275;Bazar y Varios;Otros bazar;Revisar;Revisar
ME-1127;Crema corporal anticelulítica Deliplus;20;Bazar y Varios;Otros bazar;Revisar;Revisar
ME-1134;Crema corporal Esferas Vit. E&A Deliplus;31;Bazar y Varios;Otros bazar;Revisar;Revisar
ME-1121;Crema corporal Nivea;40;Bazar y Varios;Otros bazar;Revisar;Revisar
ME-1136;Crema corporal Olive Deliplus;18;Bazar y Varios;Otros bazar;Revisar;Revisar
ME-3661;Crema de avellanas y cacao Hacendado;245;Bazar y Varios;Otros bazar;Revisar;Revisar
ME-3506;Crema de calabacín Hacendado;10;Bazar y Varios;Otros bazar;Revisar;Revisar
ME-3502;Crema de calabaza Hacendado;10;Bazar y Varios;Otros bazar;Revisar;Revisar
ME-3499;Crema de espárragos Hacendado;17;Bazar y Varios;Otros bazar;Revisar;Revisar
ME-1144;Crema de manos anti-manchas Deliplus FPS 20;13;Bazar y Varios;Otros bazar;Revisar;Revisar
ME-1140;Crema de manos flor de Japón Deliplus Hidrata & Perfuma;10;Bazar y Varios;Otros bazar;Revisar;Revisar
ME-1145;Crema de manos intensiva Dove;20;Bazar y Varios;Otros bazar;Revisar;Revisar
ME-1146;Crema de manos nutritiva Karité Deliplus;13;Bazar y Varios;Otros bazar;Revisar;Revisar
ME-1147;Crema de manos Oriental Woods Deliplus;30;Bazar y Varios;Otros bazar;Revisar;Revisar
ME-1142;Crema de manos reparadora Deliplus;13;Bazar y Varios;Otros bazar;Revisar;Revisar
ME-2226;Crema de soja Hacendado;11;Bazar y Varios;Otros bazar;Revisar;Revisar
ME-3500;Crema de verduras Hacendado;17;Bazar y Varios;Otros bazar;Revisar;Revisar
ME-1481;Crema depilatoria facial Deliplus piel sensible;23;Bazar y Varios;Otros bazar;Revisar;Revisar
ME-1475;Crema depilatoria hombre Deliplus piel normal;265;Bazar y Varios;Otros bazar;Revisar;Revisar
ME-1476;Crema depilatoria mujer para el cuerpo Deliplus piel sensible;265;Bazar y Varios;Otros bazar;Revisar;Revisar
ME-1148;Crema para pies 10% urea pura Deliplus;12;Bazar y Varios;Otros bazar;Revisar;Revisar
ME-2250;Crema protección solar Deliplus FPS 50+;40;Bazar y Varios;Otros bazar;Revisar;Revisar
ME-2252;Crema protección solar facial Deliplus FPS 50+;60;Bazar y Varios;Otros bazar;Revisar;Revisar
ME-1630;Cuajada Hacendado;125;Bazar y Varios;Otros bazar;Revisar;Revisar
ME-4510;Cubo con ruedas 13L Bosque Verde;36;Bazar y Varios;Otros bazar;Revisar;Revisar
ME-4507;Cubo de basura mediano 30L Bosque Verde 30,2 x 30,5 x 41,9 cm;83;Bazar y Varios;Otros bazar;Revisar;Revisar
ME-4508;Cubo de basura pequeño 10L Bosque Verde 24,1 x 25 x 24,7 cm;725;Bazar y Varios;Otros bazar;Revisar;Revisar
ME-3469;Cubos de hielo;575;Bazar y Varios;Otros bazar;Revisar;Revisar
ME-4455;Cucharas de plástico Bosque Verde reutilizables;155;Bazar y Varios;Otros bazar;Revisar;Revisar
ME-4456;Cucharas postre de plástico Bosque Verde reutilizables;145;Bazar y Varios;Otros bazar;Revisar;Revisar
ME-1492;Cuchillas para perfilar cejas y vello facial Deliplus;28;Bazar y Varios;Otros bazar;Revisar;Revisar
ME-4458;Cuchillos de plástico Bosque Verde reutilizables;155;Bazar y Varios;Otros bazar;Revisar;Revisar
ME-1095;Cuquis Hacendado;75;Bazar y Varios;Otros bazar;Revisar;Revisar
ME-2178;Cúrcuma Hacendado;13;Bazar y Varios;Otros bazar;Revisar;Revisar
ME-2173;Curry Hacendado;11;Bazar y Varios;Otros bazar;Revisar;Revisar
ME-1430;Dátiles desecados sin hueso Hacendado;18;Bazar y Varios;Otros bazar;Revisar;Revisar
ME-1428;Dátiles en rama Hacendado;345;Bazar y Varios;Otros bazar;Revisar;Revisar
ME-1429;Dátiles Medjoul con hueso Hacendado;41;Bazar y Varios;Otros bazar;Revisar;Revisar
ME-0218;Delicias del mar de surimi Hacendado;20;Bazar y Varios;Otros bazar;Revisar;Revisar
ME-1544;Delicias elaboradas con jamón ibérico Legado Ibérico;185;Bazar y Varios;Otros bazar;Revisar;Revisar
ME-3298;Delineador de ojos Deliplus;375;Bazar y Varios;Otros bazar;Revisar;Revisar
ME-3300;Delineador de ojos Deliplus negro;375;Bazar y Varios;Otros bazar;Revisar;Revisar
ME-0844;Dentífrico 3 action Deliplus;11;Bazar y Varios;Otros bazar;Revisar;Revisar
ME-0845;Dentífrico Anticaries Deliplus;105;Bazar y Varios;Otros bazar;Revisar;Revisar
ME-0835;Dentífrico Bicarbonato blanqueador Deliplus;11;Bazar y Varios;Otros bazar;Revisar;Revisar
ME-0833;Dentífrico Blanqueador Bicarbonato Signal;185;Bazar y Varios;Otros bazar;Revisar;Revisar
ME-0843;Dentífrico Dental Pearl Deliplus blanqueador;195;Bazar y Varios;Otros bazar;Revisar;Revisar
ME-0842;Dentífrico Encías Protect Deliplus;17;Bazar y Varios;Otros bazar;Revisar;Revisar
ME-0840;Dentífrico Fresh Gel Deliplus menta extra refrescante;11;Bazar y Varios;Otros bazar;Revisar;Revisar
ME-0852;Dentífrico gel Blanqueador Xtrem Deliplus;17;Bazar y Varios;Otros bazar;Revisar;Revisar
ME-0841;Dentífrico Herbal Deliplus;11;Bazar y Varios;Otros bazar;Revisar;Revisar
ME-0846;Dentífrico infantil + 2 años Deliplus;10;Bazar y Varios;Otros bazar;Revisar;Revisar
ME-0848;Dentífrico infantil +6 años Deliplus menta suave;10;Bazar y Varios;Otros bazar;Revisar;Revisar
ME-0849;Dentífrico infantil +6 años Deliplus sabor gominola;10;Bazar y Varios;Otros bazar;Revisar;Revisar
ME-0831;Dentífrico Pro-Expert Oral-B sabor menta especiada;285;Bazar y Varios;Otros bazar;Revisar;Revisar
ME-0834;Dentífrico Protección Caries Colgate;195;Bazar y Varios;Otros bazar;Revisar;Revisar
ME-0836;Dentífrico Repair & Protect Sensodyne;495;Bazar y Varios;Otros bazar;Revisar;Revisar
ME-0850;Dentífrico reparación activa de encías Parodontax menta fresca;495;Bazar y Varios;Otros bazar;Revisar;Revisar
ME-0847;Dentífrico Sensitive Deliplus con hidroxiapatita;15;Bazar y Varios;Otros bazar;Revisar;Revisar
ME-0853;Dentífrico Total Expert Deliplus con paraprobiótico;19;Bazar y Varios;Otros bazar;Revisar;Revisar
ME-4306;Desatascador de Tuberías Bosque Verde en gel;185;Bazar y Varios;Otros bazar;Revisar;Revisar
ME-4307;Desatascador Turbo Bosque Verde en gel;17;Bazar y Varios;Otros bazar;Revisar;Revisar
ME-0634;Desmaquillador de ojos y labios bifásico Waterproof Facial Clean;20;Bazar y Varios;Otros bazar;Revisar;Revisar
ME-4390;Difusor insecticida antimosquitos Bosque Verde eléctrico;31;Bazar y Varios;Otros bazar;Revisar;Revisar
ME-4407;Difusor multifragancia eléctrico Bosque Verde;32;Bazar y Varios;Otros bazar;Revisar;Revisar
ME-0631;Discos desmaquillantes Deliplus ovalados algodón 100%;15;Bazar y Varios;Otros bazar;Revisar;Revisar
ME-0628;Discos desmaquillantes Deliplus redondos algodón 100%;105;Bazar y Varios;Otros bazar;Revisar;Revisar
ME-4195;Disuelve manchas Bosque Verde;19;Bazar y Varios;Otros bazar;Revisar;Revisar
ME-3466;Doble caldo sabor clásico carne Knorr en pastillas;175;Bazar y Varios;Otros bazar;Revisar;Revisar
ME-0175;Dorada abierta a la espalda;64;Bazar y Varios;Otros bazar;Revisar;Revisar
ME-0174;Dorada limpia;60;Bazar y Varios;Otros bazar;Revisar;Revisar
ME-3362;Dulce de membrillo Hacendado 0% azúcares añadidos;24;Bazar y Varios;Otros bazar;Revisar;Revisar
ME-3365;Dulce de membrillo taco Hacendado;21;Bazar y Varios;Otros bazar;Revisar;Revisar
ME-2064;Eau de parfum hombre Borealia Shine;110;Bazar y Varios;Otros bazar;Revisar;Revisar
ME-2077;Eau de parfum hombre Como tú Audaz;80;Bazar y Varios;Otros bazar;Revisar;Revisar
ME-2069;Eau de parfum hombre Como Tú Enciende;70;Bazar y Varios;Otros bazar;Revisar;Revisar
ME-2073;Eau de parfum hombre Como tú Eternal;80;Bazar y Varios;Otros bazar;Revisar;Revisar
ME-2062;Eau de parfum hombre Como Tú Extratime A Day;80;Bazar y Varios;Otros bazar;Revisar;Revisar
ME-2070;Eau de parfum hombre Como Tú Extratime Likes;80;Bazar y Varios;Otros bazar;Revisar;Revisar
ME-2053;Eau de parfum hombre Como Tú Fuerza;70;Bazar y Varios;Otros bazar;Revisar;Revisar
ME-2075;Eau de parfum hombre Como tú Labuan;80;Bazar y Varios;Otros bazar;Revisar;Revisar
ME-2068;Eau de parfum hombre Como Tú Rebel;80;Bazar y Varios;Otros bazar;Revisar;Revisar
ME-2054;Eau de parfum hombre Como Tú Viento;70;Bazar y Varios;Otros bazar;Revisar;Revisar
ME-2057;Eau de parfum hombre Él;100;Bazar y Varios;Otros bazar;Revisar;Revisar
ME-2061;Eau de parfum hombre My Soul;95;Bazar y Varios;Otros bazar;Revisar;Revisar
ME-2065;Eau de parfum hombre My Soul Enchanted;95;Bazar y Varios;Otros bazar;Revisar;Revisar
ME-2066;Eau de parfum hombre My Soul Glacier;120;Bazar y Varios;Otros bazar;Revisar;Revisar
ME-2076;Eau de parfum hombre My Soul Quartz;150;Bazar y Varios;Otros bazar;Revisar;Revisar
ME-2067;Eau de parfum hombre My Soul Soirée;95;Bazar y Varios;Otros bazar;Revisar;Revisar
ME-2063;Eau de parfum hombre My Soul Supreme;110;Bazar y Varios;Otros bazar;Revisar;Revisar
ME-2072;Eau de parfum hombre My Soul Vert;95;Bazar y Varios;Otros bazar;Revisar;Revisar
ME-2004;Eau de parfum mujer Blue Shine;110;Bazar y Varios;Otros bazar;Revisar;Revisar
ME-2015;Eau de parfum mujer Boem Shine;95;Bazar y Varios;Otros bazar;Revisar;Revisar
ME-1999;Eau de parfum mujer Como Tú Amor;70;Bazar y Varios;Otros bazar;Revisar;Revisar
ME-2020;Eau de parfum mujer Como Tú Atracción;80;Bazar y Varios;Otros bazar;Revisar;Revisar
ME-2026;Eau de parfum mujer Como tú Cerise;80;Bazar y Varios;Otros bazar;Revisar;Revisar
ME-2019;Eau de parfum mujer Como Tú Enciende;70;Bazar y Varios;Otros bazar;Revisar;Revisar
ME-2005;Eau de parfum mujer Como Tú Extratime A Day;80;Bazar y Varios;Otros bazar;Revisar;Revisar
ME-2018;Eau de parfum mujer Como Tú Extratime Likes;80;Bazar y Varios;Otros bazar;Revisar;Revisar
ME-2017;Eau de parfum mujer Como Tú Gold;80;Bazar y Varios;Otros bazar;Revisar;Revisar
ME-2038;Eau de parfum mujer Como Tú Sakai;80;Bazar y Varios;Otros bazar;Revisar;Revisar
ME-2029;Eau de parfum mujer Como Tú Santal;80;Bazar y Varios;Otros bazar;Revisar;Revisar
ME-2016;Eau de parfum mujer Como Tú Sinfonía;80;Bazar y Varios;Otros bazar;Revisar;Revisar
ME-2021;Eau de parfum mujer Como Tú Soplo Intense;80;Bazar y Varios;Otros bazar;Revisar;Revisar
ME-2024;Eau de parfum mujer Como Tú The Rose;80;Bazar y Varios;Otros bazar;Revisar;Revisar
ME-2008;Eau de parfum mujer Cosmic Shine;95;Bazar y Varios;Otros bazar;Revisar;Revisar
ME-2010;Eau de parfum mujer Éclant Shine;120;Bazar y Varios;Otros bazar;Revisar;Revisar
ME-1997;Eau de parfum mujer Elección;90;Bazar y Varios;Otros bazar;Revisar;Revisar
ME-2022;Eau de parfum mujer Ella;100;Bazar y Varios;Otros bazar;Revisar;Revisar
ME-2039;Eau de parfum mujer My Soul Celestial Night;110;Bazar y Varios;Otros bazar;Revisar;Revisar
ME-2037;Eau de parfum mujer My Soul Crystal;110;Bazar y Varios;Otros bazar;Revisar;Revisar
ME-2009;Eau de parfum mujer My Soul Enchanted;120;Bazar y Varios;Otros bazar;Revisar;Revisar
ME-2025;Eau de parfum mujer My Soul Rouge;95;Bazar y Varios;Otros bazar;Revisar;Revisar
ME-2006;Eau de parfum mujer My Soul Supreme;110;Bazar y Varios;Otros bazar;Revisar;Revisar
ME-1996;Eau de parfum mujer Rose Nude;90;Bazar y Varios;Otros bazar;Revisar;Revisar
ME-2027;Eau de parfum mujer Shine Special;120;Bazar y Varios;Otros bazar;Revisar;Revisar
ME-2014;Eau de parfum mujer Soirée My Soul;120;Bazar y Varios;Otros bazar;Revisar;Revisar
ME-2007;Eau de parfum mujer Verissime Bright;110;Bazar y Varios;Otros bazar;Revisar;Revisar
ME-2051;Eau de toilette hombre 9.60 Sport water;39;Bazar y Varios;Otros bazar;Revisar;Revisar
ME-2052;Eau de toilette hombre 9.60 Sport water acción;39;Bazar y Varios;Otros bazar;Revisar;Revisar
ME-2074;Eau de toilette hombre Capítulo Amaderado;65;Bazar y Varios;Otros bazar;Revisar;Revisar
ME-2060;Eau de toilette hombre Capítulo Marino;65;Bazar y Varios;Otros bazar;Revisar;Revisar
ME-2055;Eau de toilette hombre Gesto;55;Bazar y Varios;Otros bazar;Revisar;Revisar
ME-2056;Eau de toilette hombre Ikiru;80;Bazar y Varios;Otros bazar;Revisar;Revisar
ME-2059;Eau de toilette hombre Misty Wood Bosque místico;38;Bazar y Varios;Otros bazar;Revisar;Revisar
ME-2058;Eau de toilette hombre Misty Wood Esencia vital;38;Bazar y Varios;Otros bazar;Revisar;Revisar
ME-2088;Eau de toilette infantil Disney Minnie Mouse;40;Bazar y Varios;Otros bazar;Revisar;Revisar
ME-2089;Eau de toilette infantil Marvel Spiderman;40;Bazar y Varios;Otros bazar;Revisar;Revisar
ME-2023;Eau de toilette mujer 9.60 Bloom Sport water;39;Bazar y Varios;Otros bazar;Revisar;Revisar
ME-1998;Eau de toilette mujer 9.60 Sport water;39;Bazar y Varios;Otros bazar;Revisar;Revisar
ME-2013;Eau de toilette mujer Capítulo Chypre;65;Bazar y Varios;Otros bazar;Revisar;Revisar
ME-2003;Eau de toilette mujer Capítulo Floral;65;Bazar y Varios;Otros bazar;Revisar;Revisar
ME-2000;Eau de toilette mujer Ikiru;80;Bazar y Varios;Otros bazar;Revisar;Revisar
ME-2030;Eau de toilette mujer Monogotas banana;20;Bazar y Varios;Otros bazar;Revisar;Revisar
ME-2011;Eau de toilette mujer Monogotas coco;40;Bazar y Varios;Otros bazar;Revisar;Revisar
ME-2012;Eau de toilette mujer Monogotas vainilla;40;Bazar y Varios;Otros bazar;Revisar;Revisar
ME-2002;Eau de toilette mujer Soplo;70;Bazar y Varios;Otros bazar;Revisar;Revisar
ME-2001;Eau de toilette mujer Vuela;38;Bazar y Varios;Otros bazar;Revisar;Revisar
ME-4192;Eliminador de olores tejidos Bosque Verde;17;Bazar y Varios;Otros bazar;Revisar;Revisar
ME-4314;Eliminador de turbidez líquido Bosque Verde para piscina;140;Bazar y Varios;Otros bazar;Revisar;Revisar
ME-4489;Encendedor cocina largo Clipper;26;Bazar y Varios;Otros bazar;Revisar;Revisar
ME-2120;Eneldo Hacendado;185;Bazar y Varios;Otros bazar;Revisar;Revisar
ME-0878;Enjuague bucal Blanqueador Bicarbonato Deliplus zero alcohol;15;Bazar y Varios;Otros bazar;Revisar;Revisar
ME-0884;Enjuague bucal cuidado total Listerine menta;54;Bazar y Varios;Otros bazar;Revisar;Revisar
ME-0882;Enjuague bucal dientes y encías Listerine menta;54;Bazar y Varios;Otros bazar;Revisar;Revisar
ME-0877;Enjuague bucal Explosion Action Deliplus;135;Bazar y Varios;Otros bazar;Revisar;Revisar
ME-0875;Enjuague bucal Fresh 0% alcohol Deliplus;135;Bazar y Varios;Otros bazar;Revisar;Revisar
ME-0886;Enjuague bucal Kids Deliplus zero alcohol;14;Bazar y Varios;Otros bazar;Revisar;Revisar
ME-0891;Enjuague bucal Sensitive & Encías Deliplus zero alcohol;19;Bazar y Varios;Otros bazar;Revisar;Revisar
ME-0874;Enjuague bucal Total Action Deliplus;135;Bazar y Varios;Otros bazar;Revisar;Revisar
ME-0994;Ensaimada;10;Bazar y Varios;Otros bazar;Revisar;Revisar
ME-1165;Ensaimadas Hacendado;17;Bazar y Varios;Otros bazar;Revisar;Revisar
ME-0518;Entrecot de vacuno añojo;663;Bazar y Varios;Otros bazar;Revisar;Revisar
ME-0906;Envase rellenable Deliplus tamaño viaje;9;Bazar y Varios;Otros bazar;Revisar;Revisar
ME-4499;Escoba para exteriores Bosque Verde;26;Bazar y Varios;Otros bazar;Revisar;Revisar
ME-4494;Escoba para interiores Bosque Verde;18;Bazar y Varios;Otros bazar;Revisar;Revisar
ME-4498;Escoba Pequeña Bosque Verde;17;Bazar y Varios;Otros bazar;Revisar;Revisar
ME-4515;Escobilla para WC Bosque Verde;295;Bazar y Varios;Otros bazar;Revisar;Revisar
ME-4511;Escurridor para cubo ovalado Bosque Verde escurrebien;26;Bazar y Varios;Otros bazar;Revisar;Revisar
ME-0152;Espárragos verdes finos;265;Bazar y Varios;Otros bazar;Revisar;Revisar
ME-0158;Espárragos verdes gruesos;39;Bazar y Varios;Otros bazar;Revisar;Revisar
ME-1188;Espiral al cacao Hacendado;37;Bazar y Varios;Otros bazar;Revisar;Revisar
ME-4077;Esponja anatómica para bebés Deliplus;10;Bazar y Varios;Otros bazar;Revisar;Revisar
ME-0935;Esponja de baño doble acción suave masaje Deliplus;13;Bazar y Varios;Otros bazar;Revisar;Revisar
